[
  {
    "order_id": "660e8400-e29b-41d4-a716-446655440001",
    "source_order_id": "ORD-10001",
    "customer_id": "550e8400-e29b-41d4-a716-446655440001",
    "campaign_id": null,
    "order_status": "DELIVERED",
    "order_date": "2024-01-10T09:00:00Z",
    "shipped_date": "2024-01-11T14:00:00Z",
    "delivered_date": "2024-01-13T10:30:00Z",
    "total_amount": 149.99,
    "discount_amount": 10.00,
    "tax_amount": 12.50,
    "currency_code": "USD",
    "channel": "WEB",
    "created_at": "2024-01-10T09:00:00Z",
    "updated_at": "2024-01-13T10:30:00Z",
    "_schema_version": "1.0"
  },
  {
    "order_id": "660e8400-e29b-41d4-a716-446655440002",
    "source_order_id": "ORD-10002",
    "customer_id": "550e8400-e29b-41d4-a716-446655440002",
    "campaign_id": "770e8400-e29b-41d4-a716-446655440001",
    "order_status": "CANCELLED",
    "order_date": "2024-01-12T11:00:00Z",
    "shipped_date": null,
    "delivered_date": null,
    "total_amount": 75.00,
    "discount_amount": 0.00,
    "tax_amount": 6.25,
    "currency_code": "USD",
    "channel": "MOBILE",
    "created_at": "2024-01-12T11:00:00Z",
    "updated_at": "2024-01-12T15:00:00Z",
    "_schema_version": "1.0"
  }
]
